{
  "ncp_version": "0.8",
  "kind": "command_frame",
  "t": 1.0,
  "frame_id": "world",
  "mode": "active",
  "ttl_ms": 200.0,
  "channels": {
    "velocity_setpoint": {
      "data": [
        0.1,
        0.0,
        0.0
      ],
      "unit": "m/s"
    }
  },
  "horizon": [],
  "stream": {
    "epoch": "3ef6f0ad-8ee6-4c6a-9e3f-86dc9ce849a1",
    "seq": 7
  },
  "source": {
    "epoch": "7d61c9ba-4e1d-4aab-8ae6-08e05206aa67",
    "seq": 7
  },
  "source_t": 1.0,
  "session": {
    "generation": "293279f3-d459-4bfd-aeeb-604799e96925"
  },
  "session_id": "vec-open-1"
}
